<?xml version="1.0" encoding="UTF-8"?>
<cus:EmailNotification xmlns:cus="http://www.guitarcenter.com/schemas/CDM/CDMCustomerNotification"
 xmlns:xsi="http://www.w3.org/2001/XMLSchema-instance"
 xsi:schemaLocation="http://www.guitarcenter.com/schemas/CDM/CDMCustomerNotification file:/Users/rajanikanth.rachakat/Documents/vmsystem/CDMCustomerNotification.xsd">
    <NotificationType>NotificationType0</NotificationType>
    <NotificationTrackingID>NotificationTrackingID0</NotificationTrackingID>
    <EmailTo>EmailTo0</EmailTo>
    <EmailSubject>EmailSubject0</EmailSubject>
    <cus:PasswordResetConfirmNotification>
        <CustomerSource>
            <ChannelID>ChannelID0</ChannelID>
            <Brand brandID="GC.com">
                <BrandLogoURL>BrandLogoURL0</BrandLogoURL>
                <BrandName>Guitar Center</BrandName>
                <BrandURL>BrandURL0</BrandURL>
            </Brand>
            <SiteID>SiteID0</SiteID>
        </CustomerSource>
        <CustomerContact>
            <Customer>
                <FirstName>FirstName0</FirstName>
                <LastName>LastName0</LastName>
                <MiddleName>MiddleName0</MiddleName>
                <Birthday>2006-05-04</Birthday>
                <LoyaltyMemberNumber>LoyaltyMemberNumber0</LoyaltyMemberNumber>
                <CustomerID>CustomerID0</CustomerID>
                <CustomerPO>CustomerPO0</CustomerPO>
                <TaxExemptID>TaxExemptID0</TaxExemptID>
                <CustomerCreationDate>CustomerCreationDate0</CustomerCreationDate>
                <Preference name="name0">Preference0</Preference>
                <Preference name="name1">Preference1</Preference>
                <ContactAddress>
                    <AddressType>AddressType0</AddressType>
                    <AddressType>AddressType1</AddressType>
                    <FirstName>FirstName1</FirstName>
                    <LastName>LastName1</LastName>
                    <MiddleInitial>MiddleInitial0</MiddleInitial>
                    <CompanyName>CompanyName0</CompanyName>
                    <AddressLine1>AddressLine10</AddressLine1>
                    <AddressLine2>AddressLine20</AddressLine2>
                    <AddressLine3>AddressLine30</AddressLine3>
                    <AddressLine4>AddressLine40</AddressLine4>
                    <City>City0</City>
                    <State>State0</State>
                    <CountryCode>CountryCode0</CountryCode>
                    <CountryName>CountryName0</CountryName>
                    <PostalCode>PostalCode0</PostalCode>
                    <TelephoneNumber>
                        <isPrimary>false</isPrimary>
                    </TelephoneNumber>
                    <TelephoneNumber>
                        <isPrimary>false</isPrimary>
                    </TelephoneNumber>
                    <EMailAddress>
                        <Email>Email0</Email>
                        <isPrimary>false</isPrimary>
                    </EMailAddress>
                    <EMailAddress>
                        <Email>Email1</Email>
                        <isPrimary>false</isPrimary>
                    </EMailAddress>
                </ContactAddress>
            </Customer>
        </CustomerContact>
    </cus:PasswordResetConfirmNotification>
</cus:EmailNotification>
