<?xml version="1.0" encoding="UTF-8"?>
<cus:EmailNotification xmlns:cus="http://www.guitarcenter.com/schemas/CDM/CDMCustomerNotification"
 xmlns:xsi="http://www.w3.org/2001/XMLSchema-instance"
 xsi:schemaLocation="http://www.guitarcenter.com/schemas/CDM/CDMCustomerNotification file:/Users/rajanikanth.rachakat/Documents/vmsystem/CDMCustomerNotification.xsd">
    <NotificationType>NotificationType0</NotificationType>
    <NotificationTrackingID>NotificationTrackingID0</NotificationTrackingID>
    <EmailTo>EmailTo0</EmailTo>
    <EmailSubject>EmailSubject0</EmailSubject>
    <cus:EmailForPriceNotification>
        <CustomerSource>
            <ChannelID>ChannelID0</ChannelID>
            <Brand brandID="brandID0">
                <BrandLogoURL>BrandLogoURL0</BrandLogoURL>
                <BrandName>BrandName0</BrandName>
                <BrandURL>BrandURL0</BrandURL>
            </Brand>
            <SiteID>SiteID0</SiteID>
        </CustomerSource>
        <CustomerContact>
            <Customer>
                <FirstName>FirstName0</FirstName>
                <LastName>LastName0</LastName>
                <MiddleName>MiddleName0</MiddleName>
                <Birthday>2006-05-04</Birthday>
                <LoyaltyMemberNumber>LoyaltyMemberNumber0</LoyaltyMemberNumber>
                <CustomerID>CustomerID0</CustomerID>
                <CustomerPO>CustomerPO0</CustomerPO>
                <TaxExemptID>TaxExemptID0</TaxExemptID>
                <CustomerCreationDate>CustomerCreationDate0</CustomerCreationDate>
                <Preference name="name0">Preference0</Preference>
                <Preference name="name1">Preference1</Preference>
                <ContactAddress>
                    <AddressType>AddressType0</AddressType>
                    <AddressType>AddressType1</AddressType>
                    <FirstName>FirstName1</FirstName>
                    <LastName>LastName1</LastName>
                    <MiddleInitial>MiddleInitial0</MiddleInitial>
                    <CompanyName>CompanyName0</CompanyName>
                    <AddressLine1>AddressLine10</AddressLine1>
                    <AddressLine2>AddressLine20</AddressLine2>
                    <AddressLine3>AddressLine30</AddressLine3>
                    <AddressLine4>AddressLine40</AddressLine4>
                    <City>City0</City>
                    <State>State0</State>
                    <CountryCode>CountryCode0</CountryCode>
                    <CountryName>CountryName0</CountryName>
                    <PostalCode>PostalCode0</PostalCode>
                    <TelephoneNumber>
                        <isPrimary>false</isPrimary>
                    </TelephoneNumber>
                    <TelephoneNumber>
                        <isPrimary>false</isPrimary>
                    </TelephoneNumber>
                    <EMailAddress>
                        <Email>Email0</Email>
                        <isPrimary>false</isPrimary>
                    </EMailAddress>
                    <EMailAddress>
                        <Email>Email1</Email>
                        <isPrimary>false</isPrimary>
                    </EMailAddress>
                </ContactAddress>
            </Customer>
        </CustomerContact>
        <DefaultCurrency>DefaultCurrency0</DefaultCurrency>
        <PriceOfItems>
            <EnterpriseSkuID>EnterpriseSkuID0</EnterpriseSkuID>
            <ProductName>ProductName0</ProductName>
            <ProductDescription>ProductDescription0</ProductDescription>
            <ProductURL>ProductURL0</ProductURL>
            <ProductImageURL>ProductImageURL0</ProductImageURL>
            <ItemTransactionDetails>
                <TransactionType>TransactionType0</TransactionType>
                <Quantity>Quantity0</Quantity>
                <LineTotal>0</LineTotal>
            </ItemTransactionDetails>
            <ShipDate>2006-05-04T18:13:51.0</ShipDate>
            <UnitPrice>0</UnitPrice>
            <ExtPrice>0</ExtPrice>
            <ShipAndHandlingCost>0</ShipAndHandlingCost>
            <Tax>0</Tax>
            <MiscCharges>0</MiscCharges>
            <Discount>0</Discount>
            <Promotions>
                <Promotion>Promotion0</Promotion>
                <PromotionDescription>PromotionDescription0</PromotionDescription>
                <PromotionStartDate>2006-05-04T18:13:51.0</PromotionStartDate>
                <PromotionEndDate>2006-05-04T18:13:51.0</PromotionEndDate>
                <DiscountAmount>0</DiscountAmount>
            </Promotions>
            <Promotions>
                <Promotion>Promotion1</Promotion>
                <PromotionDescription>PromotionDescription1</PromotionDescription>
                <PromotionStartDate>2006-05-04T18:13:51.0</PromotionStartDate>
                <PromotionEndDate>2006-05-04T18:13:51.0</PromotionEndDate>
                <DiscountAmount>0</DiscountAmount>
            </Promotions>
            <ItemRating>ItemRating0</ItemRating>
            <TotalReviews>TotalReviews0</TotalReviews>
            <ReadReviewsURL>ReadReviewsURL0</ReadReviewsURL>
            <WriteReviewsURL>WriteReviewsURL0</WriteReviewsURL>
            <ComponentID>ComponentID0</ComponentID>
            <KitMessage>KitMessage0</KitMessage>
        </PriceOfItems>
        <PriceOfItems>
            <EnterpriseSkuID>EnterpriseSkuID1</EnterpriseSkuID>
            <ProductName>ProductName1</ProductName>
            <ProductDescription>ProductDescription1</ProductDescription>
            <ProductURL>ProductURL1</ProductURL>
            <ProductImageURL>ProductImageURL1</ProductImageURL>
            <ItemTransactionDetails>
                <TransactionType>TransactionType1</TransactionType>
                <Quantity>Quantity1</Quantity>
                <LineTotal>0</LineTotal>
            </ItemTransactionDetails>
            <ShipDate>2006-05-04T18:13:51.0</ShipDate>
            <UnitPrice>0</UnitPrice>
            <ExtPrice>0</ExtPrice>
            <ShipAndHandlingCost>0</ShipAndHandlingCost>
            <Tax>0</Tax>
            <MiscCharges>0</MiscCharges>
            <Discount>0</Discount>
            <Promotions>
                <Promotion>Promotion2</Promotion>
                <PromotionDescription>PromotionDescription2</PromotionDescription>
                <PromotionStartDate>2006-05-04T18:13:51.0</PromotionStartDate>
                <PromotionEndDate>2006-05-04T18:13:51.0</PromotionEndDate>
                <DiscountAmount>0</DiscountAmount>
            </Promotions>
            <Promotions>
                <Promotion>Promotion3</Promotion>
                <PromotionDescription>PromotionDescription3</PromotionDescription>
                <PromotionStartDate>2006-05-04T18:13:51.0</PromotionStartDate>
                <PromotionEndDate>2006-05-04T18:13:51.0</PromotionEndDate>
                <DiscountAmount>0</DiscountAmount>
            </Promotions>
            <ItemRating>ItemRating1</ItemRating>
            <TotalReviews>TotalReviews1</TotalReviews>
            <ReadReviewsURL>ReadReviewsURL1</ReadReviewsURL>
            <WriteReviewsURL>WriteReviewsURL1</WriteReviewsURL>
            <ComponentID>ComponentID1</ComponentID>
            <KitMessage>KitMessage1</KitMessage>
        </PriceOfItems>
        <PriceTotal>
            <SubTotal>0</SubTotal>
            <TotalShipAndHandlingCost>0</TotalShipAndHandlingCost>
            <TotalTax>0</TotalTax>
            <TotalMiscCharges>0</TotalMiscCharges>
            <TotalDiscount>0</TotalDiscount>
            <GroupTotal>0</GroupTotal>
        </PriceTotal>
    </cus:EmailForPriceNotification>
</cus:EmailNotification>
